{
  "type_rule_schema_version": "2.0.0",
  "rule_id": "adverb@2.0.0",
  "applies_to": ["adverb"],
  "core_fields": {
    "function": {"type": "string", "required": true, "nullable": false, "min_length": 1},
    "position": {"type": "string", "required": false, "nullable": false, "enum": ["initial", "middle", "final", "flexible"]}
  },
  "detail_fields": {
    "sentence_position_notes": {"type": "array", "required": false, "nullable": false, "items": {"type": "string", "required": false, "nullable": false, "min_length": 1}, "min_items": 1},
    "related_forms": {"type": "array", "required": false, "nullable": false, "items": {"type": "string", "required": false, "nullable": false, "min_length": 1}, "min_items": 1, "unique_items": true}
  },
  "allow_undeclared_core_fields": false,
  "allow_undeclared_detail_fields": false,
  "conditional_requirements": [],
  "linguistic_checks": ["Function and sentence-position description match contemporary usage."]
}
